{
  "kind": "docs",
  "repo": ".claude-prime",
  "coordinator_root_path": ".",
  "inputs": { "commits_since": 26, "last_update_docs_sha": "f8483d47" },
  "threshold": "any commits since last update-docs run",
  "computed_state": "stale",
  "overdue": true,
  "observed_at": "2026-06-22T03:02:00Z",
  "computed_as_of": "2026-06-22T03:02:01Z",
  "provenance": {
    "source_kind": "coordinator_artifact",
    "repo": ".claude-prime",
    "ref": { "branch": "work/machine-b/2026-06-17to22", "sha": "647732fa" },
    "path": "",
    "observed_at": "2026-06-22T03:02:00Z",
    "derivation": "rolled_up"
  }
}
